<?xml version="1.0" encoding="ISO-8859-1" ?>
<!DOCTYPE component PUBLIC
  "-//MyFaces//DTD MyFaces component def 1.0//EN"
  "http://myfaces.sourceforge.net/dtd/Component.dtd">
<component>
    <component-class>net.sourceforge.myfaces.component.ext.HtmlDataList</component-class>
    <base-class>javax.faces.component.UIData</base-class>
    <component-type>net.sourceforge.myfaces.HtmlDataList</component-type>
    <renderer-type>net.sourceforge.myfaces.List</renderer-type>
    <field>
        <name>layout</name>
        <type>java.lang.String</type>
    </field>
    <field>
        <name>firstRowFlag</name>
        <type>java.lang.String</type>
    </field>
    <field>
        <name>lastRowFlag</name>
        <type>java.lang.String</type>
    </field>
</component>
