<?xml version="1.0" encoding="ISO-8859-1" ?>
<!DOCTYPE component PUBLIC
  "-//MyFaces//DTD MyFaces component def 1.0//EN"
  "http://myfaces.sourceforge.net/dtd/Component.dtd">
<component>
    <component-class>net.sourceforge.myfaces.custom.datatablescroller.HtmlDataTableScroller</component-class>
    <base-class>javax.faces.component.UICommand</base-class>
    <component-type>net.sourceforge.myfaces.HtmlDataTableScroller</component-type>
    <component-family>javax.faces.Command</component-family>
    <renderer-type>net.sourceforge.myfaces.TableScroller</renderer-type>
    <field>
        <name>for</name>
        <type>java.lang.String</type>
    </field>
</component>
