<?xml version="1.0" encoding="ISO-8859-1" ?>
<!DOCTYPE component PUBLIC
  "-//MyFaces//DTD MyFaces component def 1.0//EN"
  "http://myfaces.sourceforge.net/dtd/Component.dtd">
<component>
    <component-class>org.apache.myfaces.custom.tree.HtmlTree</component-class>
    <base-class>javax.faces.component.html.HtmlForm</base-class>
    <component-type>org.apache.myfaces.HtmlTree</component-type>
    <component-family>org.apache.myfaces.HtmlTree</component-family>
    <renderer-type>org.apache.myfaces.HtmlTree</renderer-type>
    <field>
        <name>value</name>
        <type>java.lang.String</type>
    </field>
    <field>
        <name>styleClass</name>
        <type>java.lang.String</type>
    </field>
    <field>
        <name>nodeClass</name>
        <type>java.lang.String</type>
    </field>
    <field>
        <name>selectedNodeClass</name>
        <type>java.lang.String</type>
    </field>
    <field>
        <name>iconLine</name>
        <type>java.lang.String</type>
    </field>
    <field>
        <name>iconNoline</name>
        <type>java.lang.String</type>
    </field>
    <field>
        <name>iconChild</name>
        <type>java.lang.String</type>
    </field>
    <field>
        <name>iconChildFirst</name>
        <type>java.lang.String</type>
    </field>
    <field>
        <name>iconChildMiddle</name>
        <type>java.lang.String</type>
    </field>
    <field>
        <name>iconChildLast</name>
        <type>java.lang.String</type>
    </field>
    <field>
        <name>iconNodeOpen</name>
        <type>java.lang.String</type>
    </field>
    <field>
        <name>iconNodeOpenFirst</name>
        <type>java.lang.String</type>
    </field>
    <field>
        <name>iconNodeOpenMiddle</name>
        <type>java.lang.String</type>
    </field>
    <field>
        <name>iconNodeOpenLast</name>
        <type>java.lang.String</type>
    </field>
    <field>
        <name>iconNodeClose</name>
        <type>java.lang.String</type>
    </field>
    <field>
        <name>iconNodeCloseFirst</name>
        <type>java.lang.String</type>
    </field>
    <field>
        <name>iconNodeCloseMiddle</name>
        <type>java.lang.String</type>
    </field>
    <field>
        <name>iconNodeCloseLast</name>
        <type>java.lang.String</type>
    </field>
</component>
