<?xml version="1.0" encoding="ISO-8859-1" ?>
<!DOCTYPE component PUBLIC
  "-//MyFaces//DTD MyFaces component def 1.0//EN"
  "http://myfaces.sourceforge.net/dtd/Component.dtd">
<component generateUserRoleMethods="true" >
    <component-class>net.sourceforge.myfaces.custom.navmenu.jscookmenu.HtmlCommandJSCookMenu</component-class>
    <base-class>javax.faces.component.UICommand</base-class>
    <component-type>net.sourceforge.myfaces.JSCookMenu</component-type>
    <component-family>javax.faces.Command</component-family>
    <field>
        <name>layout</name>
        <type>java.lang.String</type>
    </field>
    <field>
        <name>theme</name>
        <type>java.lang.String</type>
    </field>
    <field>
        <name>enabledOnUserRole</name>
        <type>java.lang.String</type>
    </field>
    <field>
        <name>visibleOnUserRole</name>
        <type>java.lang.String</type>
    </field>
</component>
