<?xml version="1.0" encoding="ISO-8859-1" ?>
<!DOCTYPE component PUBLIC
  "-//MyFaces//DTD MyFaces component def 1.0//EN"
  "http://myfaces.sourceforge.net/dtd/Component.dtd">
<component generateStateMethods="false" >
    <component-class>net.sourceforge.myfaces.component.html.ext.HtmlDataTable</component-class>
    <base-class>javax.faces.component.html.HtmlDataTable</base-class>
    <component-type>net.sourceforge.myfaces.HtmlDataTable</component-type>
    <field>
        <name>preserveDataModel</name>
        <type>boolean</type>
        <default-value>false</default-value>
    </field>
    <field>
        <name>preserveSort</name>
        <type>boolean</type>
        <default-value>false</default-value>
    </field>
    <field>
        <name>enabledOnUserRole</name>
        <type>java.lang.String</type>
    </field>
    <field>
        <name>visibleOnUserRole</name>
        <type>java.lang.String</type>
    </field>
    <field>
        <name>renderedIfEmpty</name>
        <type>boolean</type>
        <default-value>true</default-value>
    </field>
</component>
