<?xml version="1.0" encoding="ISO-8859-1" ?>
<!DOCTYPE component PUBLIC
  "-//MyFaces//DTD MyFaces component def 1.0//EN"
  "http://myfaces.sourceforge.net/dtd/Component.dtd">
<component>
    <component-class>net.sourceforge.myfaces.custom.datascroller.HtmlDataScroller</component-class>
    <base-class>javax.faces.component.UIComponentBase</base-class>
    <component-type>net.sourceforge.myfaces.HtmlDataScroller</component-type>
    <component-family>javax.faces.Panel</component-family>
    <renderer-type>net.sourceforge.myfaces.DataScroller</renderer-type>
    <field>
        <name>for</name>
        <type>java.lang.String</type>
    </field>
</component>
