<?xml version="1.0" encoding="ISO-8859-1" ?>
<!DOCTYPE component PUBLIC
  "-//MyFaces//DTD MyFaces component def 1.0//EN"
  "http://myfaces.sourceforge.net/dtd/Component.dtd">
<component generateUserRoleMethods="true" >
    <component-class>net.sourceforge.myfaces.component.html.ext.HtmlMessages</component-class>
    <base-class>javax.faces.component.html.HtmlMessages</base-class>
    <component-type>net.sourceforge.myfaces.HtmlMessages</component-type>
    <renderer-type>net.sourceforge.myfaces.Messages</renderer-type>
    <field>
        <name>summaryFormat</name>
        <type>java.lang.String</type>
    </field>
    <field>
        <name>globalSummaryFormat</name>
        <type>java.lang.String</type>
    </field>
    <field>
        <name>detailFormat</name>
        <type>java.lang.String</type>
    </field>
    <field>
        <name>enabledOnUserRole</name>
        <type>java.lang.String</type>
    </field>
    <field>
        <name>visibleOnUserRole</name>
        <type>java.lang.String</type>
    </field>
</component>
