<?xml version="1.0" encoding="ISO-8859-1" ?>
<!DOCTYPE component PUBLIC
  "-//MyFaces//DTD MyFaces component def 1.0//EN"
  "http://myfaces.sourceforge.net/dtd/Component.dtd">
<component>
    <component-class>net.sourceforge.myfaces.custom.radio.HtmlRadio</component-class>
    <base-class>javax.faces.component.UIComponentBase</base-class>
    <component-type>net.sourceforge.myfaces.HtmlRadio</component-type>
    <component-family>net.sourceforge.myfaces.Radio</component-family>
    <field>
        <name>for</name>
        <type>java.lang.String</type>
    </field>
    <field>
        <name>index</name>
        <type>int</type>
        <default-value>-1</default-value>
    </field>
</component>
