<?xml version="1.0" encoding="ISO-8859-1" ?>
<!DOCTYPE component PUBLIC
  "-//MyFaces//DTD MyFaces component def 1.0//EN"
  "http://myfaces.sourceforge.net/dtd/Component.dtd">
<component generateUserRoleMethods="true" >
    <component-class>net.sourceforge.myfaces.component.html.ext.HtmlPanelGroup</component-class>
    <base-class>javax.faces.component.html.HtmlPanelGroup</base-class>
    <component-type>net.sourceforge.myfaces.HtmlPanelGroup</component-type>
    <component-family>javax.faces.Panel</component-family>
    <renderer-type>javax.faces.Group</renderer-type>
    <field>
        <name>enabledOnUserRole</name>
        <type>java.lang.String</type>
    </field>
    <field>
        <name>visibleOnUserRole</name>
        <type>java.lang.String</type>
    </field>
</component>
