<?xml version="1.0" encoding="ISO-8859-1" ?>
<!DOCTYPE component PUBLIC
  "-//MyFaces//DTD MyFaces component def 1.0//EN"
  "http://myfaces.sourceforge.net/dtd/Component.dtd">
<component generateStateMethods="true">
    <component-class>net.sourceforge.myfaces.component.html.MyFacesHtmlCommandLink</component-class>
    <base-class>javax.faces.component.html.HtmlCommandLink</base-class>
    <component-type>net.sourceforge.myfaces.HtmlCommandLink</component-type>
    <component-family>javax.faces.Command</component-family>
    <renderer-type>net.sourceforge.myfaces.Link</renderer-type>
    <field>
        <name>target</name>
        <type>java.lang.String</type>
    </field>
    <field generateProperty="false" >
        <name>actionUpdateProperty</name>
        <type>javax.faces.el.ValueBinding</type>
    </field>
    <field>
        <name>actionUpdateValue</name>
        <type>java.lang.String</type>
    </field>
</component>
