<?xml version="1.0" encoding="ISO-8859-1" ?>
<!DOCTYPE component PUBLIC
  "-//MyFaces//DTD MyFaces component def 1.0//EN"
  "http://myfaces.sourceforge.net/dtd/Component.dtd">
<component>
    <component-class>net.sourceforge.myfaces.component.ext.HtmlInputCalendar</component-class>
    <base-class>javax.faces.component.UIInput</base-class>
    <component-type>net.sourceforge.myfaces.HtmlInputCalendar</component-type>
    <component-family>javax.faces.Input</component-family>
    <renderer-type>net.sourceforge.myfaces.Calendar</renderer-type>
    <field>
        <name>monthYearRowClass</name>
        <type>java.lang.String</type>
    </field>
    <field>
        <name>weekRowClass</name>
        <type>java.lang.String</type>
    </field>
    <field>
        <name>dayCellClass</name>
        <type>java.lang.String</type>
    </field>
    <field>
        <name>currentDayCellClass</name>
        <type>java.lang.String</type>
    </field>
</component>
