<?xml version="1.0" encoding="ISO-8859-1" ?>
<!DOCTYPE component PUBLIC
  "-//MyFaces//DTD MyFaces component def 1.0//EN"
  "http://myfaces.sourceforge.net/dtd/Component.dtd">
<component generateStateMethods="true" generateUserRoleMethods="true" >
    <component-class>net.sourceforge.myfaces.component.html.ext.HtmlOutputText</component-class>
    <base-class>javax.faces.component.html.HtmlOutputText</base-class>
    <component-type>net.sourceforge.myfaces.HtmlOutputText</component-type>
    <field>
        <name>enabledOnUserRole</name>
        <type>java.lang.String</type>
    </field>
    <field>
        <name>visibleOnUserRole</name>
        <type>java.lang.String</type>
    </field>
</component>
